{
  "$schema": "https://json-schema.org/draft/2020-12/schema",
  "title": "LlmChatResponse",
  "description": "OpenAI-compatible chat completion. Extra fields pass through.",
  "type": "object",
  "required": [
    "choices"
  ],
  "properties": {
    "id": {
      "type": "string"
    },
    "model": {
      "type": "string"
    },
    "choices": {
      "type": "array",
      "items": {
        "type": "object",
        "properties": {
          "index": {
            "type": "integer"
          },
          "message": {
            "type": "object",
            "properties": {
              "role": {
                "type": "string"
              },
              "content": {
                "type": [
                  "string",
                  "null"
                ]
              }
            }
          },
          "finish_reason": {
            "type": [
              "string",
              "null"
            ]
          }
        }
      }
    },
    "usage": {
      "type": "object",
      "properties": {
        "prompt_tokens": {
          "type": "integer"
        },
        "completion_tokens": {
          "type": "integer"
        },
        "total_tokens": {
          "type": "integer"
        }
      }
    }
  }
}
