{
  "id": "chatcmpl-example",
  "model": "tinglang-course-standard",
  "choices": [
    {
      "index": 0,
      "message": {
        "role": "assistant",
        "content": "{\"clips\": []}"
      },
      "finish_reason": "stop"
    }
  ],
  "usage": {
    "prompt_tokens": 1830,
    "completion_tokens": 12,
    "total_tokens": 1842
  }
}
